commit	score	public0_tps	public1_tps	public2_tps	status	description
0d92f17	528.6	132.3	275.0	1792.8	keep	Optimize Qwen decode with CUDA graphs and grouped attention
a339a7f	541.6	136.8	276.9	1835.6	keep	Pack Qwen projections and fuse BF16 SwiGLU
1799644	624.2	157.8	303.8	2165.6	keep	Fuse decode head normalization rotary embedding and KV writes
fb686a3	644.6	160.7	309.2	2252.7	keep	Fuse BF16 residual additions into RMSNorm
a410d2c	789.4	192.9	399.6	2518.6	keep	Use dense split-KV Triton attention for graphed decode
af06883	843.3	207.0	417.3	2694.0	keep	Select BF16 skinny projection kernels during bounded warmup
f565305	873.0	228.8	435.7	2774.2	keep	Capture prefill and use native Flash grouped-query attention
8f6dbb5	885.9	227.1	473.1	2803.8	keep	Fuse prefill Q/K norm, RoPE and KV writes; evaluate only the final query in the last layer
dd09e1c	926.0	239.3	488.2	2926.8	keep	Stream tokens through pinned snapshots with bounded decode lookahead
a161a1b	925.5	240.5	485.2	2921.3	discard	Measure more projection layouts and dense attention interval layouts during warmup
1cbd367	932.0	241.7	494.5	2956.7	keep	Launch SwiGLU on a row grid and store fused prefill queries token-major
e20537c	934.6	244.2	497.7	2938.7	keep	Measure launch widths of the small decode kernels during warmup
344ca6d	945.5	247.9	501.4	3031.7	keep	Add lossless 12-bit storage of decode projection weights, selected only if bit-exact and faster
5c96d33	934.2	242.0	493.0	2957.1	discard	Read packed weight planes as 32-bit words; keep the plain layout when a packed recheck fails
072d3e1	930.2	240.9	495.9	2940.7	discard	Pack with per-row exponent windows; add word-load BF16 layouts; shorten the layout search
538acc6	933.1	242.3	491.4	2951.3	discard	Reproducibility check: restore candidate 14 projection selection exactly
dbe42ab	932.6	241.9	493.0	2948.1	discard	Refine projection layouts against the captured decode step itself
aa7c31d	0.0	0	0	0	crash	Refine attention layouts and launch widths against the captured decode step
baa5ae1	932.4	241.0	495.0	2945.9	discard	Remove lossless packing and word loads; keep a short in-situ refinement within the 15-minute run limit
e618984	948.1	251.0	501.2	2987.1	keep	Exact self-speculative decoding for a single sequence with paced release
12620d1	947.0	270.0	492.9	2945.5	discard	Speculate from a model-derived successor table; shared-KV block attention with per-row positions
24743f9	0.0	257.3	501.1	2943.5	crash	Speculate for every batch whose verify block fits 16 rows; release pace 0.75
1e46d6f	984.9	253.2	507.0	2990.0	keep	Record candidate 22 failure on the plain batch-16 path; rerun the identical engine
631c296	1002.6	254.2	496.1	2931.7	keep	Fuse speculation propose/settle bookkeeping into two Triton kernels
ebc2876	999.8	256.2	494.8	3037.0	discard	Trial: one speculative draft per row for batches 9-16
8adb604	1042.4	268.1	495.9	3136.8	keep	Draft from one-token suffix matches before falling back to the successor table
607e1f5	1014.5	254.2	495.2	3104.8	discard	Longer verify chains for batches 1-2 and a second draft for batches 5-8
80ab1ef	1051.3	296.1	532.7	3132.6	keep	Tree drafts: verify alternatives for the first draft and relocate the kept K/V slot
de99361	1061.4	285.0	515.5	3157.1	keep	Skinny GEMM up to 32 rows; 8-token tree blocks through batch 4
8a7b9f5	1065.5	290.9	502.3	3173.5	keep	Adaptive release pacing from the process's own unpaced speeds
d14ca21	1049.5	282.4	512.1	3069.1	discard	Full 9+7 tree blocks for batches 1-2
ff9307f	1051.7	292.9	519.5	3147.8	discard	Keep verify blocks within 16 rows where possible
f5adf3b	1062.5	306.8	518.1	3110.1	discard	Refine verify-block projection tiles against the captured verify graph
622d4fd	1065.4	286.2	523.9	3197.9	discard	Pace floor 0.70 from the lab's spread model; lower running median
f3e6c80	1054.6	281.3	513.1	3099.8	discard	Choose each row's chain depth per pass from its matched-suffix length
b0e2d76	1075.7	299.7	515.2	3147.5	keep	The warmup generation never sets the release pace
039a52e	1063.3	289.2	526.5	3101.9	discard	Verify block size from batch and prompt length
0f40fa8	1048.8	280.1	517.7	3212.3	discard	Consumers read split-GEMM partials directly instead of a merge launch
093634e	0.0	0	0	0	crash	Two-context successor table; single-pass block attention option (from john-jpet's fork)
45146de	1092.3	300.8	542.6	3188.5	keep	Drop the cuBLASLt and 64-row trials from the stack
b1ca1cc	1095.1	310.6	527.1	3224.2	keep	Batches 9-16 also measure a 64-row verify block
80b0ec4	1090.3	311.0	519.8	3152.0	discard	Ranked candidate drafts: scored first draft and alternatives
662342b	1080.3	315.1	525.0	3162.8	discard	Record candidate 44 (1092.3, #1)
80d38ef	0.0	0	0	0	crash	compile_spec: block attention is covered by compile_single_pass
d6ddeeb	0.0	0	0	0	crash	Record candidates 50/51; describe candidate 52
6334ff5	1097.7	306.1	536.0	3240.8	keep	Speculative mode leaves one-token projection shapes on cuBLAS: the tuning budget goes to verify blocks
6a30231	1115.0	317.3	529.3	3175.9	keep	Trim tuning budgets: candidate 52 hit the 900 s run cap
c096f57	1129.7	306.1	530.0	3120.6	keep	Record candidate 53 (1097.7, #1)
663a895	1111.9	318.3	526.8	3180.3	discard	32 MiB cuBLAS workspace, as recommended for Hopper
8d34093	1090.2	292.6	515.6	3142.0	discard	Revert the 32 MiB cuBLAS workspace (1111.9 vs 1129.7); candidate 62 stack
da6c794	1112.9	288.3	522.7	3173.9	discard	Describe candidate 66 bundle
822ce98	1130.6	311.0	544.7	3292.3	keep	Attention layout refinement never ranks below the smaller projections
bc52548	0.0	0	0	0	crash	Mask-free attention prefix loop only where K/V traffic is large; attention layout refined first again
73063f2	0.0	0	0	0	crash	Record candidate 67 (1130.6, #1, 612 s)
17e882c	1118.8	321.9	527.3	3293.8	discard	Revert the 64-row tile path (run cap); candidate 76 stack with trimmed budgets
7cfb7f1	1115.5	293.8	521.5	3260.6	discard	Second draw of the best engine (candidate 67 tree) while candidate 76 measures
d25a167	1114.1	310.3	543.7	3234.5	discard	TMA attention option, persistent TMA GEMM kinds, per-batch block-size table
2721207	1119.2	277.4	522.1	3213.3	discard	PDL self-test: the scalar arrives as a pointer
f8da493	1121.4	316.8	539.6	3223.2	discard	Revert the per-batch block-size table (candidate 79: -1.5% on hidden shapes); candidate 82 stack
53e4a7a	1140.0	324.1	542.3	3269.8	keep	PDL off: it slowed the batch-1 pass by 13% on the platform (early blocks starve the running kernel)
425f95f	1119.2	314.9	528.1	3253.8	discard	Pass time for pacing: the fastest of five back-to-back groups
92386d2	1118.7	316.8	550.7	3236.9	discard	Record candidate 85 (1140.0, new best, 648 s)
6d93ee0	1122.1	312.9	532.2	3227.8	discard	Revert the plain-decode attention search (candidates 86+87 scored -1.6%); keep the pacing measurement
c758faf	1144.3	307.8	541.2	3201.6	keep	Warp-width knobs cover 17-64-row blocks and the embedding norm
44edf62	1103.3	321.9	528.4	3245.2	discard	Back to two passes in flight: the third delayed the next sample's prefill
9e15bd4	1130.9	317.3	528.8	3215.4	discard	Read completion stamps through a shared NumPy view
5d61f22	0.0	0	0	0	crash	Maintain draft sibling membership incrementally
1e4bc33	1127.4	324.7	528.3	3250.1	discard	Back to candidate 91's tuning knobs: refine 16 s, three passes in flight
a3696f5	0.0	0	0	0	crash	Three-deep pipeline for the non-TMA tile GEMMs; fix the offline harness to pass alignment attributes
bec0e9f	1111.9	293.9	542.6	3255.7	discard	Cut warmup back under the 900 s cap: pipeline depth 2, tuning 22 s, refine 12 s
f02f277	0.0	324.4	524.4	3226.7	crash	Name the Triton cache directory so compiles survive across the six workloads
d0dca7c	0.0	0	0	0	crash	Reset the engine to the 1144.3 tree; add only the named Triton cache
97d43d2	1053.1	323.8	452.0	3048.3	discard	Remove the shared Triton cache: it failed a hidden case; restore the 1144.3 tree exactly
4fbebc7	1129.1	325.2	531.9	3295.2	discard	Poll the completion stamp through a shared NumPy view
661376a	1122.2	323.4	533.3	3246.2	discard	Time the verify pass with a replay already in flight
720efca	0.0	0	0	0	crash	Word-sized embedding rows and an incremental sibling mask
2cd0d19	1121.0	322.5	522.0	3211.8	discard	Speculate above 16 sequences
0dbe286	1105.5	303.3	532.7	3172.9	discard	Take the fused lm_head argmax by default
59d71c8	1094.0	308.3	514.7	3201.5	discard	Split the projections to fill the machine, not to reach 512 programs
dd14cb7	1135.5	318.7	528.7	3249.5	discard	Accept a drafted token within ACCEPT_MARGIN logits of the argmax
ec11817	1143.7	325.4	534.3	3345.3	discard	Relaxed acceptance at margin 1.25
